Variable,Description
YROTHER4,How many years R born a member of other group4
YROTHER5,How many years R born a member of other group5
YRINFRM1,How many years R born a member of informal group1
YRINFRM2,How many years R born a member of informal group2
YRINFRM3,How many years R born a member of informal group3
YRINFRM4,How many years R born a member of informal group4
YRINFRM5,How many years R born a member of informal group5
MTFRAT1,How many years R born a member of fraternity group1
MTFRAT2,How many years R born a member of fraternity group2
MTFRAT3,How many years R born a member of fraternity group3
MTFRAT4,How many years R born a member of fraternity group4
MTSERV1,Service club1 meets in this area
MTSERV2,Service club2 meets in this area
MTSERV3,Service club3 meets in this area
MTSERV4,Service club4 meets in this area
MTSERV5,Service club5 meets in this area
MTSERV6,Service club6 meets in this area
MTSERV7,Service club7 meets in this area
MTSERV8,Service club8 meets in this area
MTVET1,Veteran group1 meets in this area
MTVET2,Veteran group2 meets in this area
MTVET3,Veteran group3 meets in this area
MTVET4,Veteran group4 meets in this area
MTVET5,Veteran group5 meets in this area
MTPOLIT1,Political club1 meets in this area
MTPOLIT2,Political club2 meets in this area
MTPOLIT3,Political club3 meets in this area
MTUNION1,Labor union1 meets in this area
MTUNION2,Labor union2 meets in this area
MTUNION3,Labor union3 meets in this area
MTUNION4,Labor union4 meets in this area
MTSPORT1,Sport club1 meets in this area
MTSPORT2,Sport club2 meets in this area
MTSPORT3,Sport club3 meets in this area
MTSPORT4,Sport club4 meets in this area
MTSPORT5,Sport club5 meets in this area
MTSPORT6,Sport club6 meets in this area
MTYOUTH1,Youth group1 meets in this area
MTYOUTH2,Youth group2 meets in this area
MTYOUTH3,Youth group3 meets in this area
MTYOUTH4,Youth group4 meets in this area
MTYOUTH5,Youth group5 meets in this area
MTSCHL1,School service group1 meets in this area
MTSCHL2,School service group2 meets in this area
MTSCHL3,School service group3 meets in this area
MTSCHL4,School service group4 meets in this area
MTHOBBY1,Hobby club1 meets in this area
MTHOBBY2,Hobby club2 meets in this area
MTHOBBY3,Hobby club3 meets in this area
MTGREEK1,School frarternity1 meets in this area
MTGREEK2,School frarternity2 meets in this area
MTGREEK3,School frarternity3 meets in this area
MTNAT1,Nationality group1 meets in this area
MTNAT2,Nationality group2 meets in this area
MTNAT3,Nationality group3 meets in this area
MTFARM1,Farm organization1 meets in this area
MTFARM2,Farm organization2 meets in this area
MTFARM3,Farm organization3 meets in this area
MTLIT1,Military group1 meets in this area
MTLIT2,Military group2 meets in this area
MTLIT3,Military group3 meets in this area
MTLIT4,Military group4 meets in this area
MTPROF1,Professional society1 meets in this area
MTPROF2,Professional society2 meets in this area
MTPROF3,Professional society3 meets in this area
MTPROF4,Professional society4 meets in this area
MTPROF5,Professional society5 meets in this area
MTPROF6,Professional society6 meets in this area
MTCHURH1,Church group1 meets in this area
MTCHURH2,Church group2 meets in this area
MTCHURH3,Church group3 meets in this area
MTCHURH4,Church group4 meets in this area
MTCHURH5,Church group5 meets in this area
MTCHURH6,Church group6 meets in this area
MTOTHER1,Other group1 meets in this area
MTOTHER2,Other group2 meets in this area
MTOTHER3,Other group3 meets in this area
MTOTHER4,Other group4 meets in this area
MTOTHER5,Other group5 meets in this area
MTINFRM1,Informal group1 meets in this area
MTINFRM2,Informal group2 meets in this area
MTINFRM3,Informal group3 meets in this area
MTINFRM4,Informal group4 meets in this area
MTINFRM5,Informal group5 meets in this area
GRPBOTH1,Both belong to the same group on the list
GRPBOTH2,Both belong to the same group on the list
GRPBOTH3,Both belong to the same group on the list
GRPBOTH4,Both belong to the same group on the list
GRPBOTH5,Both belong to the same group on the list
FRSTMET1,R first met the named alter in the group
FRSTMET2,R first met the named alter in the group
FRSTMET3,R first met the named alter in the group
FRSTMET4,R first met the named alter in the group
FRSTMET5,R first met the named alter in the group
YRSKWN1,Years R has known the named1
YRSKWN2,Years R has known the named2
YRSKWN3,Years R has known the named3
YRSKWN4,Years R has known the named4
YRSKWN5,Years R has known the named5
RELNEG,Any turning point when less committed to religion
NEWSFROM,Main source of information about events in the news
SCIFROM,Main source of information about science and technology
SEEKSCI,Probable source of information about scientific issues
NEXTGEN,Science & tech. give more opportunities to next generation
TOOFAST,Science makes our way of life change too fast
BETTRLFE,Science makes our lives better
ADVFRONT,Sci Rsch is necessary and should be supported by federal govt
SCISPEC,Science is too concerned with theory and speculation
LEADSCI,Shld pay attntn only to theory accepted by leading scientists
WHICHSCI,Industry scientists less reliable than univeR'sity scientists
ASTROLGY,Ever read a horoscope or Personal astrology report
ASTROSCI,Astrology is scientific
SCIBNFTS,Benefits of sci research outweigh harmful results
BALPOS,Sci research is strongly in favor of benefits
BALNEG,Sci research is strongly in favor of harmful results
SCISTUDY,R has clear understanding of scientific study
SCITEXT,What it means to R to study scientifically
EXPDESGN,Better way to test drug btw control and non-control
EXPTEXT,Why is it better to test drug this way
ODDS1,Test of knowledge about probablity1
ODDS2,Test of knowledge about probablity2
HOTCORE,Sci knowledge: the center of earth is very hot
RADIOACT,Sci knowledge: the center of earth is very hot
BOYORGRL,Sci knowledge: father gene decides sex of baby
LASERS,Sci knowledge: lasers work by focusing sound waves
ELECTRON,Sci knowledge: electrons are smaller than atoms
VIRUSES,Sci knowledge: antibiotics kill viruses as well as bacteria
BIGBANG,Sci knowledge: the universe began with a huge explosion
BIGBANG1,Universe began with a big explosion: true or false
BIGBANG2,Universe expanding since it began: true or false
CONDRIFT,Sci knowledge: the continents have been moving
EVOLVED,Sci knowledge: human beings developed from animals
EVOLVED1,Humans developed from earlier species: true or false
EVOLVED2,Elephants evolved from earlier species: true or false
EARTHSUN,Sci knowledge: the earth goes around the sun
SOLARREV,Sci knowledge: how long the earth goes around the sun
TOMATOES,Regular tomatoes no genes
INTRHOME,Internet access in R's home
COLDEG1,The highest degree R have earned
MAJORCOL,The field of degree R earned
COLSCI,R has taken any college-level sci course
COLSCINM,Number of college-level sci courses R have taken
HSMATH,The highest level of math R completed in high school
HSBIO,R ever took a high school biology course
HSCHEM,R ever took a high school chemistry course
HSPHYS,R ever took a high school physics course
GWSCI,Understanding of global warming by environmnt scientists
GWPOL,Understanding of global warming by elected officials
GWBIZ,Understanding of global warming by business leaders
SCIAGRGW,Extent of agreement on global warming amg env scientists
SCIINFGW,Influence on global warming policy: environmntal scientists
POLINFGW,Influence on global warming policy: elected official
BIZINFGW,Influence on global warming policy: business leader
SCIBSTGW,Best policy vs narrow interest: environmental scientist
POLBSTGW,Best policy vs narrow interest: elected official
BIZBSTGW,Best policy vs narrow interest: business leader
GASREGS,How much R favor requiring to make caR's using less gasoline
SCMED,How well medical researcheR's understand stem cells
SCRELIG,How well religious leaders understand stem cells
SCPOL,How well elected officials understand stem cells
MEDAGRSC,Agreement by med researchers on importance of stem cell rsch
MEDINFSC,Influence on funding for stem cell rsch: medical researchers
RELINFSC,Influence on funding for stem cell rsch: religious leaders
POLINFSC,Influence on funding for stem cell rsch: elected officials
MEDBSTSC,Best policy on stem cell vs narrow interest: med researcher
RELBSTSC,Best policy on stem cell vs narrow interest: relig leader
POLBSTSC,Best policy on stem cell vs narrow interest: elected official
SCRESRCH,Government should fund stem cell research
TXECO,How well economist knows effect of reducing fed income tax
TXBIZ,How well business leader knows effect of reducing fed inc tax
TXPOL,How well elected official knows effect of reducing fed inc tax
ECOAGREE,Agreement by economists on effect of reducing fed inc tax
ECOINFTX,Influence on reducing fed inc taxby economists
BIZINFTX,Influence on reducing fed inc taxby business leaders
POLINFTX,Influence on reducing fed inc taxby elected officials
ECOBSTTX,Best policy vs narrow interest on fed inc tax: economist
BIZBSTTX,Best policy vs narrow interest on fed inc tax: business leader
POLBSTTX,Best policy vs narrow interest on fed inc tax: elected official
GMMED,How well med researcher know risk by genetically modified foods
GMPOL,How well elected official know risk by genetically modified foods
GMBIZ,How well business leader know risk by genetically modified foods
MEDAGRGM,Med researcher: agreement on effect of genetically modified food
MEDINFGM,Influence on restricting gmf by medical researcheR's
POLINFGM,Influence on restricting gmf by elected officials
BIZINFGM,Influence on restricting gmf by business leaders
MEDBSTGM,Best policy on gmf vs narrow interest: medical researcher
POLBSTGM,Best policy on gmf vs narrow interest: elected official
BIZBSTGM,Best policy on gmf vs narrow interest: business leader
EATGM,R's view about eating genetically modified foods
SCIIMP1,How important: done by scientists in univeR'sity settings
SCIIMP2,How important: having advanced degrees in their fields
SCIIMP3,How important: conclusion based on solid evidence
SCIIMP4,How important: examining different interpretation of results
SCIIMP5,How important: results consistent with religious beliefs
SCIIMP6,How important: results consistent with common sense
SCIIMP7,How important: repeating experiment & finding same result
SCIIMP8,How important: research takes place in a laboratory
SOCSCI,How scientific: sociology
PHYSCSCI,How scientific: physics
HISTSCI,How scientific: history
ACCNTSCI,How scientific: accounting
BIOSCI,How scientific: biology
ECONSCI,How scientific: economics
MEDSCI,How scientific: medicine
ENGNRSCI,How scientific: engineering
KNWFORGN,Level of R's information: foreign policy
KNWECON,Level of R's information: economic policy
KNWSCI,Level of R's information: science and technology
KNWGW,Level of R's information: global warming
KNWPOLAR,Level of R's information: the north and south poles
TVBEARS,R would choose TV program about polar bears
TVINUIT,R would choose TV program about native ppl in the arctic
TVOZONE,R would choose TV program about ozone hole over the antarctic
TVMELTNG,R would choose TV program about polar ice melting
TVOIL,R would choose TV program about oil drilling in the arctic
POLARYR1,Intl polar year 07-08:R would watch a TV program
POLARYR2,Intl polar year 07-08:R would read a newspaper article
POLARYR3,Intl polar year 07-08:R would read a magazine article
POLARYR4,Intl polar year 07-08:R would go to museum
POLARYR5,Intl polar year 07-08:R would watch a feature film
POLARYR6,Intl polar year 07-08:R would read a book
POLARYR7,Intl polar year 07-08:R would visit a web site
POLARYR8,Intl polar year 07-08:R would attend a live lecture
ICESHEET,True-false: the north pole is on a sheet of ice
NOSUN,True-false: the sun never shines at the south pole
INUIT,True-false: inuit live north of the arctic circle
HUNTBEAR,True-false: hunting make polar bear extinct than climate change
ICECAPS,Polar ice caps got larger or smaller over last 25 yrs
COMORSCI,Antarctica should be reserved or open
EXTINCT,Effect of global warming: polar beaR's become extinct
SEALEVEL,Effect of global warming: sea level flood coastal areas
ARTSEALS,Effect of global warming: arctic seals are threatened
PENGUINS,Antarctic penguins threatened
INUITWAY,Effect of global warming: inuit no longer follow traditional way of life
NOICECAP,Effect of global warming: northern ice cap melt
CAREMOST,Most concerned possible effect of global warming
NANOTECH,How much R heard about nanotechnology
NANOKNW1,True-false: nanotechnology manipulate extremely small units
NANOKNW2,True-false: nanoscale differ from same material at larger scale
NANOWILL,Benefit of nanotechnology outweigh harmful results
NANOBEN,Balance will be strongly in favor of the benefits or slightly
NANOHARM,Balance will be strongly in favor of the benefits or slightly
SCIMODE,Was SAQ self administered or interview administered
INTINTL,Interested in international issues
INTFARM,Interested in farm issues
INTEDUC,Interested in local school issues
INTSCI,Interested in new scientific discoveries
INTECON,Interested in economic issues
INTTECH,Interested in technologies
INTMED,Interested in medical discoveries
INTSPACE,Interested in space exploration
INTENVIR,Interested in environmental issues
INTMIL,Interested in military policy
SCIINTRO,Which version of science introduction was used
VISART,How often R visited art museum last year
VISNHIST,How often R visited natural history museum last year
VISZOO,How often R visited zoo last year
VISSCI,How often R visited science museum
VISLIB,How often R visited public library last year
SCIMATH,Quality of science & math educ in us is inadequate
ANSCITST,Scientists shld be allowed to do research animals' pain & injury
MABOYGRL,Does mom's gene decide baby's sex
H2OLIFE,What property of water is most important
ANHEAT,Which bodily features be best suited to a small animal living in a cold climate
LFTPLANE,Key factor that enables airplane to lift
STORMTXT,Do you see lightning before hearing thunder
LITMSTXT,Why litmus paper doesn't change color in mixed solution
GOLDFISH,Experiment about goldfish and temperature
SALTH2O,Ocean water for vegetables
EROSION,Example of erosion
GENES,Traits are transferred over generation
GILLS,How fish get oxygen
UPBREATH,Why short breath at the top of a mountain
DAYNIGHT,When did most errors occur
WEIGHING,Which is the best method to report weight of leaf
SEESAND,Which picture shows what she should use for the 2nd pot
FISHEXP1,What is scientist trying to find out from this experiment
FISHEXP2,Why did you choose that answer
MOREMPG,Cars use less gasoline
POLNUKE,How well elected official know risk by nuclear power
BIZNUKE,How well business leader know risk by nuclear power
ENGNUKE,Nuclear engineers understand nuclear power
ENGAGRNK,Engineers agree nuclear power
ENHINFNK,Nuclear engineers how much influence
POLINFNK,Elected officials how much influence
BIZINFNK,Business leaders how much influence
ENGBSTNK,Nuclear engineers best for country
POLBSTNK,Elected officials best for country
BIZBSTNK,Business leaders best for country
NUKEELEC,View about nuclear energy
CLONING,Cloning makes identical copy
SCINEWS1,Newspaper printed or online
SCINEWS2,Magazine printed or online
SCINEWS3,Where online get info
NEWSFRMY,Where news events info
SCIFROMY,Where get science and technology info
SEEKSCIY,Where get science issue news
SCIINFGO,Where online get info
SCIENTDA,Happy if daughter scientist
SCIENTSN,Happy if son scientist
SCIENTR,Consider career in science
SCIENTDO,Know what scientists do
SCIENTAL,Scientists usually work alone
SCIENTDN,Scientific work dangerous
SCIENTGO,Scientists work for good of humanity
SCIENTFU,Scientists don? have fun
SCIENTHE,Scientists help solve prob
SCIENTOD,Scientists odd and peculiar
SCIENTBE,Scientists want to make life better for avg person
SCIENTRE,Scientists not religious
SCIENTWK,Scientists only interested in work
SCIENTMO,Scientists earn less
SCIENTBR,Being a scientist boring
ENGDA,Happy if daughter engineer
ENGSON,Happy if son engineer
ENGRESP,Consider work in engineer field
ENGDO,Know what engineers do
ENGLONE,Engineers usually work alone
ENGDGR,Engineering work dangerous
ENGGOOD,Engineers work for good of humanity
ENGFUN,Engineers don? have fun
ENGPROB,Engineers help solve prob
ENGODD,Engineers odd and peculiar
ENGBTR,Engineers want to make life better for avg person
ENGREL,Engineers not religious
ENGINT,Engineers only interested in work
ENGEARN,Engineers earn less
ENGBRNG,Being engineer boring
FARMING,How scientific is farming
JOURNLSM,How scientific is journalism
FIREFTNG,How scientific is firefighting
MARRCOUN,How scientific is marriage counseling
MEDTREAT,How scientific is medical treatment
ARCHITCT,How scientific is architecture
LAWENFRC,How scientific is law enforcement
ENGNRING,How scientific is engineering
SLSMNSHP,How scientific is salesmanship
CMPRGMNG,How scientific is computer programming
FINLCOUN,How scientific is financial counseling
BUYVALUE,Percent of company stock R bought from own money
OPS2005,Company granted R stock options in 2005
EXTR2005,Received performance based payment in 2005
COMPWAGE,Annual wages in previous year were higher than same jobs in other companies
TALKTEAM,If employee not working: talk directly to the employee
NUMORG,Number of people working in organization at all locations
EMPINPUT,R involved in any task force for decision-making
SLFMANGD,R involved in a self-managed team
EMPTRAIN,Received formal training from employer
WEALTH,Total wealth of respondent
ESOP,R is member of esop
DEFPENSN,R has defined benefit pension plan
TRDESTCK,Company stock publicly traded
BUYESOP,Does employee ownership matter when R thinks about buying from a company
ESOPNOT,Would R rather work for a company with an ESOP or cash sharing
COMPANY,Which company would R prefer to work for
VIGLAB06,X is experiencing alchl dependencedepression schizophrenia
MHTRTOTH,R Personally has known someone who received treatment
MHOTHYOU,How much distress his mental health problem caused r
MHOTHREL,Result of mental health problem to relationship with him
SEEMHPUB,How frequently R sees someone mentally ill in public
GESTTALK,How often R see people making strange gesture in public
AVOIDMH,R changed shopping place due to presence of mentally ill ppl
NUMKNOWN,Variable that drives skips in module
ACQKEVIN,Number of Kevin R is acquainted with
ACQKAREN,Number of Karen R is acquainted with
ACQSHAWN,Number of Shawn R is acquainted with
ACQBRNDA,Number of Brenda R is acquainted with
ACQKEITH,Number of Keith R is acquainted with
ACQRACHL,Number of Rachel R is acquainted with
ACQMARK,Number of Mark R is acquainted with
ACQLINDA,Number of Linda R is acquainted with
ACQJOSE,Number of Jose R is acquainted with
ACQMARIA,Number of Maria R is acquainted with
ACQUNEMP,Number of ppl currently unemployed R is acquainted with
ACQHOME,Number of ppl owning second home R is acquainted with
ACQPRISN,Number of ppl in prison R is acquainted with
ACQASIAN,Number of Asian R is acquainted with
ACQBLACK,Number of black R is acquainted with
ACQHISP,Number of Hispanic R is acquainted with
ACQWHITE,Number of white R is acquainted with
ACQGAY,Number of gay R is acquainted with
ACQCOHAB,Number of cohabiting pplR is acquainted with
ACQGOATT,Number of regular church attendee R is acquainted with
ACQNOATT,Number of non church attendee R is acquainted with
ACQLIB,Number of strong liberal R is acquainted with
ACQCON,Number of strong conservative R is acquainted with
ACQCOPS,Number of police officer R is acquainted with
ACQLAWS,Number of lawyer R is acquainted with
ACQSOCS,Number of social worker R is acquainted with
ACQJANS,Number of janitor R is acquainted with
ACQCHILD,Number of child care worker R is acquainted with
ACQELECS,Number of electrician R is acquainted with
ACQMILS,Number of ppl in military service R is acquainted with
ACQFMMRK,Number of family member named Mark
ACQFMLIN,Number of family member named Linda
ACQFMUNE,Number of unemployed family member
ACQFMHME,Number of family member owning second home
ACQFMPRI,Number of family member in prison
ACQFMASN,Number of Asian family member
ACQFMBLK,Number of black family member
ACQFMHSP,Number of Hispanic family member
ACQFMWHT,Number of white family member
ACQFMGAY,Number of gay family member
ACQFMGO,Number of family member going church regularly
ACQFMNO,Number of family member not going church
ACQFMLIB,Number of liberal in family member
ACQFMCON,Number of conservative in family member
ACQFMCOH,Number of cohabiting family member
ACQNHMRK,Number of Mark in neighborhood
ACQNHLIN,Number of Linda in neighborhood
ACQNHUNE,Number of ppl unemployed in neighborhood
ACQNHHME,Number of ppl owning second home in neighborhood
ACQNHPRI,Number of ppl in prison in neighborhood
ACQNHASN,Number of Asian in neighborhood
ACQNHBLK,Number of black in neighborhood
ACQNHHSP,Number of Hispanic in neighborhood
ACQNHWHT,Number of white in neighborhood
ACQNHGAY,Number of gay in neighborhood
ACQNHGO,Number of regular church attendee in neighborhood
ACQNHNO,Number of non church attendee in neighborhood
ACQNHLIB,Number of liberal in neighborhood
ACQNHCON,Number of conservative in neighborhood
ACQNHCOH,Number of cohabiting ppl in neighborhood
ACQWKMRK,Number of Mark in current or previous work
ACQWKLIN,Number of Linda in current or previous work
ACQWKUNE,Number of ppl unemployed in current or previous work
ACQWKHME,Number of ppl owning second home in current or previous work
ACQWKPRI,Number of ppl in prison in current or previous work
ACQWKASN,Number of Asian in current or previous work
ACQWKBLK,Number of black in current or previous work
ACQWKHSP,Number of Hispanic in current or previous work
ACQWKWHT,Number of white in current or previous work
ACQWKGAY,Number of gay in current or previous work
ACQWKGO,Number of regular church attendee in current or previous work
ACQWKNO,Number of non church attendee in current or previous work
ACQWKLIB,Number of strong liberal in current or previous work
ACQWKCON,Number of strong conservative in current or previous work
ACQWKCOH,Number of cohabiting ppl in current or previous work
ACQVAMRK,Number of Mark in voluntary association
ACQVALIN,Number of Linda in voluntary association
ACQVAUNE,Number of unemployed ppl in voluntary association
ACQVAHME,Number of ppl owning second home in voluntary association
ACQVAPRI,Number of ppl in prison in voluntary association
ACQVAASN,Number of Asian in voluntary association
ACQVABLK,Number of black in voluntary association
ACQVAHSP,Number of Hispanic in voluntary association
ACQVAWHT,Number of white in voluntary association
ACQVAGAY,Number of gay in voluntary association
ACQVAGO,Number of regular church attendee in voluntary association
ACQVANO,Number of non church attendee in voluntary association
ACQVALIB,Number of liberal in voluntary association
ACQVACON,Number of conservative in voluntary association
ACQVACOH,Number of cohabiting ppl in voluntary association
ACQREPS,Number of republican R is acquainted with
ACQDEMS,Number of democrat R is acquainted with
ACQATTND,Number of regular church attendee R is acquainted with
ACQMYRAC,Proportion of same race as R among all acquaintances
TRTKEVIN,Number of Kevin R trust
TRTKAREN,Number of Karen R trust
TRTSHAWN,Number of Shawn R trust
TRTBRNDA,Number ofBrenda R trust
TRTKEITH,Number ofKeith R trust
TRTRACHL,Number ofRachel R trust
TRTMARK,Number ofMark R trust
TRTLINDA,Number ofLinda R trust
TRTJOSE,Number ofJose R trust
TRTMARIA,Number ofMaria R trust
TRTCOPS,Number of police officer R trust
TRTLAWS,Number of lawyer R trust
TRTSOCS,Number of social worker R trust
TRTJANS,Number of janitor R trust
TRTCHILD,Number of child care worker R trust
TRTELECS,Number of electrician R trust
TRTMILS,Number of ppl in military service R trust
TRTUNEMP,Number of ppl unemployed R trust
TRTHOME,Number of ppl owning second homeR trust
TRTPRISN,Number of ppl in prisonR trust
TRTASIAN,Number of Asian R trust
TRTBLACK,Number of black R trust
TRTHISP,Number of Hispanic R trust
TRTWHITE,Number of white R trust
TRTGAY,Number of gay R trust
TRTCOHAB,Number of cohabiting ppl R trust
TRTGOATT,Number of church attendeeR trust
TRTNOATT,Number of non church attendeeR trust
TRTLIB,Number of strong liberalR trust
TRTCON,Number of strong conservativeR trust
TRTREPS,Proportion of republican R trust
TRTDEMS,Proportion of democrat R trust
TRTATTND,Proportion of regular church attendee R trust
TRTMYRAC,Proportion of same race as R among ppl R trust
GUNSALES,Should background check be required for private gun sale
GUNSDRUG,Should penalty for illegal gun sale be tougher than drug
SEMIGUNS,Should semi-auto gun sale be limited to military
GUNS911,Should gun control law be stricter after 911
RIFLES50,Should high power rifle sale be limited to military
OTHGUNS,Number of adult owing a gun in household
GUNSDRNK,Should carrying a firearm drinking alcohol be illegal
SPNATDIS,Should govt spend more or less on natural disasters
NATDISIN,Should helping ppl in natural disaster be govt resp
NATDISCM,Should rebuilding community in disaster be govt resp
NEWSPRNT,How often Does R read traditional newspaper
GETAHEAY,Opinion of why people get ahead
DISABLD1,R has a hearing problem
DISABLD2,R has a vision problem
DISABLD3,R has a physical disability
DISABLD4,R has other physical disability
DISABLD5,R has emotional or mental disability
DISABLD6,R has difficulty in learning remembering or concentrating
DISABLD7,R has difficulty in daily activities
VIGVERMY,Vignette version
MHPROBLM,How serious X s situation is
MHDOFAM,What X should do: talk to family
MHDOFRND,What X should do: talk to friends
MHDOREL,What X should do: talk to relic leader
MHDODOC,What X should do: go to doctor
MHDOPSYC,What X should do: go to psychiatrist
MHDOMHP,What X should do: go to counselor
MHDOHEAL,What X should do: go to spiritual healer
MHDOOTC,What X should do: take non-prescription medication
MHDORX,What X should do: take prescription medication
