Variable,Description
REALTORF,Convenience made R choose the realtor
REALTOR1,What was the most important reason?
RELAGENT,Your relationship to the real estate agent
WARRNTYH,Did the seller provide any warranty
SATHOME,How satisfied with your purchase
LAWYER,Hired a lawyer in the past 10 yrs?
LAWYERA,My own previous knowledge of the firm
LAWYERB,A friend or relative recommended them
LAWYERC,An acquaintance recommended them.
LAWYERD,General reputation in the community
LAWYERE,I saw their advertisement
LAWYERF,I searched for the best price.
LAWYERG,Convenience
LAWYER1,What was the most important reason?
RELLAW,Relationship to the attorney
SATLAWYR,How satisfied with the legal services
FIXHOME,Home maintenance services past 10 years?
FIXERA,My own previous knowledge of the firm
FIXERB,A friend or relative recommended them
FIXERC,An acquaintance recommended them.
FIXERD,General reputation in the community
FIXERE,I saw their advertisement
FIXERF,I searched for the best price
FIXER1,What was the most important reason?
RELFIXER,Relationship to the person who did the work
SATFIXES,How satisfied were you with the work
BORROWED,Have you borrowed $100+ from another person
WHOLOAND,From whom did you borrow this money?
SELLBED,Would you rather sell bedroom furniture
SELLAUTO,O would you rather sell an automobile
SELLHOME,E would you rather sell a house-condominium
TRANSOTH,Hwould you be to mention problems
LOANED,Loaned $100+ past 12 months?
LOANEDTO,Oto whom did you lend this money?
BUYBED,Would you buy furniture from a business
BUYAUTO,Would you buy a car from a business
BUYLAW,Would you buy legal svcs from a business
BUYFIXES,Would you buy home maintenance from a business
BUYHOME,Would you buy a house from a business
TRANSREL,How likely to mention problems to relatives
FRNDDEAL,People usually get a better price from friends
FRNDAWK,Discussing price is awkward among friends
TABLPRCE,The factory not lowering price acceptable?
ORGANSB,Which procedures be used to assign the organ
ORGANSW,Which of these procedures would be the worst?
SELLORGN,Should people be permitted to sell a kidney
ADOPTION,Best way to match birth Mothers with adopters?
SELLBABY,Surrogate Mothers should be permitted
SELLSEX,Nothing inherently wrong with prostitution
REQINFO,Resp. of gov. to require biz. to provide info
NATRECON,Natural environments should be left alone
TAGSALES,How frequently do you go to garage sales etc
HAGGLE,Do you expect to negotiate for a lower price?
WKFAMBIZ,Work for pay in a farm etc owned by your family?
HRFAMBIZ,How many hours per week?
FAMBIZ,What kind of business is this?
ECONSYS,Best-needs replaced
FAMFINAN,How you and your spouse organize your finances
DECAUTO,Deciding whether or not to buy an automobile
DECBED,Deciding whether or not to buy bedroom furniture
DECGIFT,Deciding on major charitable gifts.
LAYOFFS,Who has the greatest right to keep their jobs?
VOLHLTH,Done volunteer work in health past 12 mnths
VOLEDUC,Done volunteer work in education
VOLRELIG,Done volunteer work in religious org
VOLHUMAN,Done volunteer work in human services
VOLENVIR,Done volunteer work in environment
VOLPUB,Done volunteer work in pub-soc benefit
VOLREC,Done volunteer work in recreation adults
VOLART,"Done volunteer work in arts, culture, etc"
VOLWORK,Done volunteer work in work-related org
VOLPOL,Done volunteer work in political org. etc
VOLYOUTH,Done volunteer work in youth development
VOLFOUND,Done volunteer work in priv & comm. found
VOLINTL,Done volunteer work in international
VOLINFRM,Done volunteer work in informal-alone
VOLOTH,Done volunteer work in other (specify)___
MONHLTH,Done volunteer work in health past month
MONEDUC,Done volunteer work in education
MONRELIG,Done volunteer work in religious org
MONHUMAN,Done volunteer work in human services
MONENVIR,Done volunteer work in environment
MONPUB,Done volunteer work in pub-soc benefit
MONREC,Done volunteer work in recreation adults
MONART,"Done volunteer work in arts, culture, etc"
MONWORK,Done volunteer work in work-related org
MONPOL,Done volunteer work in political org. etc
MONYOUTH,H done volunteer work in youth development
MONFOUND,Done volunteer work in priv & comm. found
MONINTL,Done volunteer work in international
MONINFRM,Done volunteer work in informal-alone
MONOTH,Done volunteer work in other (specify)
HRSHLTH,How many hours spent in health past month
HRSEDUC,How many hours spent in education
HRSRELIG,How many hours spent in religious org past
HRSHUMAN,How many hours spent in human services
HRSENVIR,How many hours spent in environment
HRSPUB,How many hours spent in pub-soc benefit
HRSREC,How many hours spent in recreation adults
HRSART,"How many hours spent in arts, culture"
HRSWORK,How many hours spent in work-related org
HRSPOL,How many hours spent in political org. etc
HRSYOUTH,How many hours spent in youth development
HRSFOUND,How many hours spent in priv & comm.
HRSINTL,How many hours spent in international
HRSINFRM,How many hours spent in informal-alone
HRSOTH,How many hours spent in other (specify)
GIVHLTH,Contributed money in 1995 in health
GIVEDUC,Contributed money in education
GIVRELIG,Contributed money in religious org
GIVHUMAN,Contributed money in human services
GIVENVIR,Contributed money in environment
GIVPUB,Contributed money in pub-soc benefit
GIVREC,Contributed money in recreation adults
GIVART,"Contributed money in arts, culture, etc"
GIVWORK,Contributed money in work-related org
GIVPOL,Contributed money in political org. etc
GIVYOUTH,Contributed money in youth development
GIVFOUND,Contributed money in priv & comm. found
GIVINTL,Contributed money in international
GIVINFRM,Contributed money in informal-alone
GIVOTH,Contributed money in other (specify)
TOTHLTH,How much money contributed in health
TOTEDUC,How much money contributed in education
TOTRELIG,How much money contributed in religious org
TOTHUMAN,How much money contributed in human services
TOTENVIR,How much money contributed in environment
TOTPUB,How much money contributed in pub-soc benefit
TOTREC,How much money contributed in recreation adults
TOTART,"How much money contributed in arts, culture, etc"
TOTWORK,How much money contributed in work-related org
TOTPOL,How much money contributed in political org. etc
TOTYOUTH,How much money contributed in youth development
TOTFOUND,How much money contributed in priv & comm. found
TOTINTL,How much money contributed in international
TOTINFRM,How much money contributed in informal-alone
TOTOTH,How much money contributed in other (specify)
VALHLTH,Estimated value contributed in health
VALEDUC,Estimated value contributed in education
VALRELIG,Estimated value contributed in religious org
VALHUMAN,Estimated value contributed in human services
VALENVIR,Estimated value contributed in environment
VALPUB,Estimated value contributed in pub-soc benefit
VALREC,Estimated value contributed in recreation adults
VALART,"Estimated value contributed in arts, culture, etc"
VALWORK,Estimated value contributed in work-related org
VALPOL,Estimated value contributed in political org. etc
VALYOUTH,Estimated value contributed in youth development
VALFOUND,Estimated value contributed in priv & comm. found
VALINTL,Estimated value contributed in international
VALINFRM, estimated value contributed in informal-alone
VALOTH,Estimated value contributed in other (specify)
HOMELESS,Contributed to the homeless
NEEDYNEI,Contributed to a needy neighbor.
NEEDYREL,Contributed to a needy relative.
NEEDYFRD,Contributed to a needy friend.
NEEDYOTH,Contributed to other needy person
PROBFIX1,First mention of problem
PROBFIX2,Second mention of problem
PROBFIX3,Third mention of problem
PROBHLP1,First mention to help problem
PROBHLP2,Second mention to help problem
PROBHLP3,Third mention to help problem
VIGVERSN, vignette version number
SERIOUSP,How serious X s situation is
CHARACTR,How likely X s situation caused by bad character
IMBALNCE,How likely X s situation caused by imbalance in brain
WAYRAISE,How likely X s situation caused by the way raised
STRESSES,How likely X s situation caused by stress
GENETICS,How likely X s situation caused by genetic problem
GODSWILL,How likely X s situation caused by god s will
UPSDOWNS,How likely X is experiencing normal ups-and-downs of life
BREAKDWN,How likely X is experiencing nervous breakdown
MENTLILL,How likely X is experiencing mental illness
PHYSILL,How likely X is experiencing physical illness
VIGLABEL,How likely X is experiencing vignettes
DECTREAT,How able is X to decide receive treatment
DECMONEY,How able is X to decide managing own money
IMPRVOWN,How likely X s situation will improve on its own
IMPRVTRT,How likely X s situation will improve with treatment
VIGNEI,How willing R would have X as a neighbor
VIGSOC,How willing R would spend time socializing with X
VIGFRND,How willing R would make friends with X
VIGWORK,How willing R would work closely with X on a job
VIGGRP,How willing R would have a group home for x
VIGMAR,How willing R would have X marry in R's family
HURTOTH,How likely X violent toward other people
HURTSELF,How likely X violent toward oneself
TLKFAM,X should talk to family and friends
TLKCLRGY,X should talk to religious leader
MEDDOC,X should go to general medical doctor for help
MENTLDOC,X should go to psychiatrist for help
MENTLOTH,X should go to other mental health professional for help
SPHEALER,X should go to spiritual healer for help
SELFHELP,X should join a self-group with similar problem
OTCMED,X should take non-prescription medication
RXMED,X should take prescription medication
MENTLHOS,X should check into a mental hospital
DOFIRST,Here are the things you said {#SecL_NAME} should do...  INTERVIEWER: READ LIST  What is the first this/he should do?
ORTLKFM,In what order talk things over with family & friends
ORTLKCLR,"In what order talk to a minister, priest, rabbi etc"
ORMEDDOC,In what order go to a general medical doctor
ORMNTLDC,In what order go to a psychiatrist for help
ORMNTLOT,"In what order go to a therapist, or counselor"
ORHEALER,In what order go to a spiritual or a natural healer
ORSLFHLP,In what order join a self-help group
OROTCMED,In what order take non-prescription medication
ORRXMED,In what order take prescription medication
ORMNTLHS,In what order check into a mental hospital
MUSTDOC,X should be forced to be examined at a clinic by law
MUSTMED,X should be forced to take prescribed medication by law
MUSTHOSP,X should be admitted to be hospitalized for treatment by law
DANGRSLF,X should be admitted to be hospitalized for treatment if dangerous to x
DANGROTH,X should be admitted to be hospitalized for treatment if dangerous to others
MEDCARE1,Who R thinks should be most responsible for cost of xs medical care
MEDCARE2,Who R thinks should be next most responsible for cost of xs medical care
SPMENTL,Govt spending on health
GOVMENTL,Should govt provide health care for mental illness
MNTLAS1,"1st mention, what mental illness is, asserted"
MNTLAS2,"2nd mention, what mental illness is, asserted"
MNTLIMP1,"1st mention, what mental illness is, imputed"
MNTLIMP2,"2nd mention, what mental illness is, imputed"
MNTLIMP3,"3rd mention, what mental illness is, imputed"
MNTLSYM1,"1st mention, what mental illness is, symptoms"
MNTLSYM2,"2nd mention, what mental illness is, symptoms"
MNTLSYM3,"3rd mention, what mental illness is, symptoms"
MNTLOTH,"What mental illness is, other codes"
BRKDAS1,"1st mention, what nervous breakdown is, asserted"
BRKDAS2,"2nd mention, what nervous breakdown is, asserted"
BRKDIMP1,"1st mention, what nervous breakdown is, imputed"
BRKDIMP2,"2nd mention, what nervous breakdown is, imputed"
BRKDIMP3,"3rd mention, what nervous breakdown is, imputed"
BRKDSYM1,"1st mention, what nervous breakdown is, symptoms"
BRKDSYM2,"2nd mention, what nervous breakdown is, symptoms"
BRKDSYM3,"3rd mention, what nervous breakdown is, symptoms"
BRKDOTH,"What nervous breakdown is, other codes"
KNWMHOSP,Know anyone who was in a hospital
RELMHSP1,Patient was self
RELMHSP2,Patient was immediate family
RELMHSP3,Patient was other relatives
RELMHSP4,Patient was close friend
RELMHSP5,Patient was acquaintance
RELMHSP6,Patient was other
KNWPATNT,Known anyone seeing a psychologist etc?
EVBRKDWN,Ever felt going to have a nervous breakdown?
BRKDWHY1,1st mention cause of ner. break feelings
BRKDWHY2,2nd mention cause of ner. break feelings
BRKDWHY3,3rd mention cause of ner. break feelings
BRKDDO1,1st mention what R did when felt ner. break
BRKDDO2,2nd mention what R did when felt ner. break
BRKDDO3,3rd mention what R did when felt ner. break
BRKDHLP1,1st mention what help R sought
BRKDHLP2,2nd mention what help R sought
BRKDHLP3,3rd mention what help R sought
BRKDTIME,When feelings of nervous breakdown happened
BRKDDUR,"Duration, severity of nervous breakdown feelings"
EVMHP,Ever had mental health problem
MNILWHY1,1st mention cause of mental illness feelings
MNILWHY2,2nd mention cause of mental illness feelings
MNILWHY3,3rd mention cause of mental illness feelings
MNILDO1,1st mention what R did when felt mental illness
MNILDO2,2nd mention what R did when felt mental illness
MNILDO3,3rd mention what R did when felt mental illness
MNILHLP1,1st mention what help R sought
MNILHLP2,2nd mention what help R sought
MNILHLP3,3rd mention what help R sought
MNILTIME,When feelings of mental illness happened
MNILDUR,"Duration, severity of feelings of mental illness"
KNWMW1,Gender Identity of Person 1
KNWMW2,Gender Identity of Person 2
KNWMW3,Gender Identity of Person 3
KNWMW4,Gender Identity of Person 4
KNWMW5,Gender Identity of Person 5
MHP1R1,Relation to Person 1 (1st mentioned)
MHP1R2,Relation to Person 1 (2nd mentioned)
MHP2R1,Relation to Person 2 (1st mentioned)
MHP2R2,Relation to Person 2 (2nd mentioned)
MHP3R1,Relation to Person 3 (1st mentioned)
MHP3R2,Relation to Person 3 (2nd mentioned)
MHP4R1,Relation to Person 4 (1st mentioned)
MHP4R2,Relation to Person 4 (2nd mentioned)
MHP5R1,Relation to Person 5 (1st mentioned)
MHP5R2,Relation to Person 5 (2nd mentioned)
CLOSETO1,How close R is to Person 1
CLOSETO2,How close R is to Person 2
CLOSETO3,How close R is to Person 3
CLOSETO4,How close R is to Person 4
CLOSETO5,How close R is to Person 5
SEETALK1,How frequently R sees or talks to Person 1
SEETALK2,How frequently R sees or talks to Person 2
SEETALK3,How frequently R sees or talks to Person 3
SEETALK4,How frequently R sees or talks to Person 4
SEETALK5,How frequently R sees or talks to Person 5
MHTREAT1,Is Person 1 currently receiving treatment for their mental health problem
MHTREAT2,Is Person 2 currently receiving treatment for their mental health problem
MHTREAT3,Is Person 3 currently receiving treatment for their mental health problem
MHTREAT4,Is Person 4 currently receiving treatment for their mental health problem
MHTREAT5,Is Person 5 currently receiving treatment for their mental health problem
MYPROBS1,How much Person 1's mental health condition causes R problems
MYPROBS2,How much Person 2's mental health condition causes R problems
MYPROBS3,How much Person 3's mental health condition causes R problems
MYPROBS4,How much Person 4's mental health condition causes R problems
MYPROBS5,How much Person 5's mental health condition causes R problems
SEVERE1,How severe Person 1's mental health problem is
SEVERE2,How severe Person 2's mental health problem is
SEVERE3,How severe Person 3's mental health problem is
SEVERE4,How severe Person 4's mental health problem is
SEVERE5,How severe Person 5's mental health problem is
DANGOTH1,How dangerous R thinks Person 1 is to others
DANGOTH2,How dangerous R thinks Person 2 is to others
DANGOTH3,How dangerous R thinks Person 3 is to others
DANGOTH4,How dangerous R thinks Person 4 is to others
DANGOTH5,How dangerous R thinks Person 5 is to others
DANGSLF1,How dangerous R thinks Person 1 is to themself
DANGSLF2,How dangerous R thinks Person 2 is to themself
DANGSLF3,How dangerous R thinks Person 3 is to themself
DANGSLF4,How dangerous R thinks Person 4 is to themself
DANGSLF5,How dangerous R thinks Person 5 is to themself
FAMMHNEG,R's family's negative attitudes about MH problems
OTHMHNEG,R's other acquaintences negative attitudes about MH problems
DIAGNOSD,R ever diagnosed with MH problem
MHTREATD,R ever treated for MH problem
MCSDS1,I’m always willing to admit it when I make a mistake
MCSDS2,I sometimes try to get even rather than forgive and forget
MCSDS3,At times I have really insisted on having things my own way
MCSDS4,I have never been irked when people expressed ideas very different from my own
MCSDS5,I have never deliberately said something that hurt someone’s feelings
MCSDS6,I like to gossip at times
MCSDS7,There have been occasions when I took advantage of someone
PRIVPRAY,How often pray privately
MEDITATE,How often meditate
CONGHLP1,How much congregation help out with ill
CONGHLP2,How much congregation help out with prob
CONGHRM1,How often congregation make too much demand
CONGHRM2,How often congregation critical of things R do
COPE1,Think about life is part of larger force
COPE2,Work together with god as partner's
COPE3,Look to god for strength & support
COPE4,Feel god is punishing for sin
COPE5,Wonder whether god has abandoned me
COPE6,Try to make sense without relying on god
GODWATCH,Believe in god who watch over me
LESSPAIN,Feel deep sense of resp for reducing pain
RELLIFE,Try to carry beliefs into other dealings
FORGIVE1,Have forgiven self for mistakes
FORGIVE2,Have forgiven those who hurt me
FORGIVE3,Know that god forgives me
FEELGOD,Feel gods presence
RELCMFRT,Find strength and comfort in religion
HARMONY,Feel deep inner peace or harmony
UNIONGOD,Desire to be closer to god
GODLOVE,Feel gods love directly or thru others
BEAUSPRT,Spiritually touched by beauty creation
NOCHEER,In past 30 days feel sad
NERVOUS,In past 30 days feel nervous
FIDGETY,In past 30 days feel restless or fidgety
HOPELESS,In past 30 days feel hopeless
EFFORT,In past 30 days feel everything thing effort
WRTHLESS,In past 30 days feel worthless
LOTR1,In uncertain times I usually expect best
LOTR2,If something can go wrong for me it will
LOTR3,I'm always optimistic about my future
LOTR4,I hardly ever expect things to go my way
LOTR5,I rarely count on good things happening to me
LOTR6,I expect more good things to happen to me than bad
HOPE1,I could get out of a jam
HOPE2,I am energetically pursuing my goals
HOPE3,There are many ways around problems i face
HOPE4,I see myself as successful
HOPE5,I can think of many ways to reach my current goals
HOPE6,I am meeting my current goals
RELPERSN,R consider self a religious person
SPRTPRSN,R consider self a spiritual person
RELEXP,Have religious experience changed life
NATARTS,Spending right amount on arts
ARTGOD,Thru art and music we come closer to god
ARTISTS,Excellent artists able support themselves
IRRELART,Should allow art to mock or demean religion
IRRELOFF,Offended art mocks or demeans religion
AIMOFART,Aim of art
READFICT,Read novels poems or plays
POPMUSIC,Went to a live performance of popular music
DRAMA,Went to a live drama
RELART,Had experience of art at place of worship
VOLARTS,Volunteered for organizations of arts
NATLART,Feel fed gov should provide assistance to art
STATEART,Feel state gov should provide assistance to art
LOCALART,Feel local gov should provide assistance to art
PRFMNCE,Did R go to a performance in last 12 months
ARTEXBT,Did R go to an art exhibit in last 12 months
PRFMMUS,Was it a music performance
PRFMDAN,Was it a dance performance
PRFMTHE,Was it a theater performance
PRFMATT,Did R attend alone or with others
PRFMATT1,Attended with spouse or partner
PRFMATT2,Attended with child
PRFMATT3,Attended with friend
PRFMATT4,Attended with relative
PRFMATT5,Attended with other
PRFMFREE,Was performance attended free
PRFMWHY1,Imp of low cost in decision to attend performance
PRFMWHY2,Imp of wanting to experience high quality art in decision to attend perf
PRFMWHY3,Imp of wanting to socialize with friends or fam in decision to attend perf
PRFMWHY4,Imp of wanting to celebrate cultural heritage in decision to attend perf
PRFMWHY5,Imp of wanting to support community in decision to attend perf
PRFMWHY6,Imp of wanting to learn in decision to attend perf
PRFMWHY7,Imp of location in decision to attend perf
PRFMWHY8,Imp of specific individ performer in decision to attend perf
PRFMWHY9,Was there another major reason in decision to attend perf
PRFMWHY0,Other major reason in decision to attend perf
ARTATT,Attended exhibit alone or with others
ARTATT1,Attended with spouse or partner
ARTATT2,Attended with child
ARTATT3,Attended with friend
ARTATT4,Attended with relative
ARTATT5,Attended with other
ARTFREE,Was exhibit attended free
ARTWHY1,Imp of low cost in decision to attend exhibit
ARTWHY2,Imp of wanting to experience high quality art in decision to attend exhibit
ARTWHY3,Imp of wanting to socialize with friends or fam in decision to attend exhibit
ARTWHY4,Imp of wanting to celebrate cultural heritage in decision to attend exhibit
ARTWHY5,Imp of wanting to support community in decision to attend exhibit
ARTWHY6,Imp of wanting to learn in decision to attend exhibit
ARTWHY7,Imp of location in decision to attend exhibit
ARTWHY8,Was there another major reason in decision to attend exhibit
ARTWHY9,Other major reason in decision to attend
NOGO,Perf or exhibit R wanted to go to in past 12 months but did not
NOGO1,Performance or exhibit
PRFMCOST,Did not go due to cost
PRFMINT,Did not go since not of interest
PRFMTRVL,Did not go because too dificult to get there
PRFMGST,Did not go because couldn't find anyone to go with
PRFMTIME,Did not go due to lack of time
PRFMLOC,Did not want to go to that location
PRFMOTHR,Other reason why did not go
PRFMOTHR1,Other reason why did not go
ARTCOST,Did not go due to cost
ARTINT,Did not go since not of interest
ARTTRVL,Did not go because too dificult to get there
ARTGST,Did not go because couldn't find anyone to go with
ARTTIME,Did not go due to lack of time
ARTLOC,Did not want to go to that location
ARTOTHR,Other reason why did not go
PRFMMOSTOTH,Most imp factor in not attending performance
ARTMOSTOTH,Most imp factor in not attending art exhibit
OCCYRS,How many years in your occupation
OCCTRAIN,Gone thru specialized training
TRAINSCH,How many years spent on training
TYPEORG,Work in independent or part of larger org
WRKOTH,Ever worked full time at other parts of org
OTHYRS,Years worked full time at other parts of org
PARTORG,In what ways part of the larger org
ORGSIZE,How many people employed in the entire org
GENDERWK,Mostly men or women at the workplace
LOCYRS,How long have worked at this location
SAMEWORK,Worked at other site with similar product
SITEYRS,How long have worked for those sites
OTJTRAIN,Received any on-the-job training
FORMLTRN,Did it include formal training course
FORMLFIN,Have you finished all the courses
FORMLDYS,The number of days in formal training
FORMLHRS,The number of hrs in formal training
DOINGTRN,Include informal learning by doing
DOINGFIN,Have completed this on-the-job training
DOINGDYS,How long spent on learning by doing
WOJOB,Since 1st job ever been without a job
WOJOBYRS,How many years without a job
NUMEMP,For how many employers ever worked full time
HOWPAID,How get paid last week
HOURLY,What is your hoURLy wage before tax
DAILY,What is your daily wage before tax
WEEKLY,What is your weekly wage before tax
MONTHLY,What is your monthly wage before tax
YEARLY,What is your yearly wage before tax
TRUSTING,Most people can be trusted
SEENMNTL,You or anyone you know seen a psychiatrist
PSYCMED1,Psychiatric medicine is harmful to the body
PSYCMED2,People should stop taking if symptoms gone
PSYCMED3,Taking these medicine interferes w daily act
PSYCMED4,Helps people deal w day to day stresses
PSYCMED5,Makes things easier in relations
PSYCMED6,These medications help control symptoms
PSYCMED7,Helps people feel better about themselves
USEPSYC1,Will take medicine because personal trouble
USEPSYC2,Will take medicine because cant cope w stress
USEPSYC3,Will take medicine because feeling depressed
USEPSYC4,Will take medicine because intense fear
PSYCKID1,Will give kid med because kid is hostile
PSYCKID2,Will give kid med because school trouble
PSYCKID3,Will give kid med because kid talked suicide
PSYCDRCT,Prefer go directly to a mental health spec
PSYCFDOC,Would trust family physician prescription
PSYCPSYC,Only trust psychiatrist prescription
HLTHINSR,Have health insurance
DOCLIST,Use a directory list for health care plan
ANYDOC,Can choose any doctor i like
SWITHLTH,Ever switched plan medical care provider
USEDMNTL,Have sought care with mental health since plan
MNTLCARE,Were able to get mental health care
MNTLDIF,How difficult to get mental health care
MNTLDENY,Ever denied services under plans package
HMO1,HMO improves the quality of care
HMO2,HMO prevent doctors from prescribing tests
HMO3,HMO help to control costs
HMO4,HMO prevent people from getting needed care
HMO5,HMO damage trust btwn doctors and patients
HMO6,HMO take medical decisions from physicians
HMO7,HMO make emotional mental prblm more difficult
DOC1,Doctors aren't as thorough as should be
DOC2,Doctors do best to prevent worrying
DOC3,Doctors sometimes take unnecessary risks
DOC4,Doctors are careful to check everything
DOC5,Doctors treat patients with respect
DOC6,I hardly see the same doctors each time
DOC7,Doctors avoid unnecessary patient expenses
DOC8,Doctors cause worry because don't explain
DOC9,Doctors ignore old problems care new ones
DOC10,Doctors recommend surgery if no other way
DOC11,Doctors willing to refer me a specialist
DOC12,Doctors unable to tell me all the options
DOC13,Doctors deny me the treatment needed
DOC14,Doctors put cost consideration above care
DOC15,Doctor not really care me as a person
DOC16,Doctors judgment trusted
DOC17,Doctor does not do everything should for me
DOC18,Doctor put medical needs above all other
DOC19,Doctor a real expert in taking care problem
DOC20,Doctor tell me if a mistake was made
