Variable,Description
KNWBUS,Does R know someone who is a bus driver?
KNWEXEC,Does R know someone who is a executive at a large company?
KNWCLENR,Does R know someone who is a home or office cleaner?
KNWCUTTR,Does R know someone who is a hairdresser or barber?
KNWHRMAN,Does R know someone who is a human resources or personnel manager?
KNWLAWYR,Does R know someone who is a lawyer?
KNWMCHNC,Does R know someone who is a car mechanic?
KNWNURSE,Does R know someone who is a nurse?
KNWCOP,Does R know someone who is a police officer?
KNWTCHER,Does R know someone who is a school teacher?
SMALLGAP,"For a society to be fair, differences in people's standard of living should be small"
GOVLAZY,The social benefits from the government make people lazy
PARTLSC,"In past 12 months, R has participated in orgs for sport, culture, leisure"
PARTPART,"In past 12 months, R has participated in orgs for politics or political associations"
PARTVOL,"In past 12 months, R has participated in charitable or religious volunteer orgs"
HLPHOME,Who R would first turn to if they needed help with a household or a garden job
HLPSICK,Who R would first turn to if they needed help around the house if sick
HLPDOWN,Who R would first turn to if they needed help because they were feeling down or depressed
HLPADVCE,Who R would first turn to if they needed advice about family problems
HLPSOCOC,Who R would first turn to if they wanted to enjoy a pleasant social occasion
HLPLOAN,Who R would first turn to if they needed to borrow large sums of money
HLPJOB,Who R would first turn to if they needed help finding a job
HLPPAPER,Who R would first turn to if they needed help with admin or official paperwork
HLPRESDE,Who R would first turn to if they needed help finding a place tolive
HLPSICKR,Who R would first turn to if they needed someone to look after them while seriously ill
LONELY1,How often in the past 4 weeks R has felt they lack companionship
LONELY2,How often in the past 4 weeks R has felt isolated from others
LONELY3,How often in the past 4 weeks R has felt left out
TRCOURTS,How much trust R has in American courts
TRBIGBUS,How much trust R has in major private companies in America
FAMPRESS,Do R family's members put pressure on R about the way R lives or organizes their life?
UPSET,How often R's friends or family were angry with R
DINEFRDS,How often R went out to eat or drink with at least 3 non-family members
NEWFRDS,"At these occasions, how often did R make new friends or acquaintences"
CONWKDAY,Number of people R contacts with on a typical weekday
CONF2F,How many people R sees face to face
CNTCTPAR,How often R contacts their most-contacted parent
CNTCTSIB,How often R contacts their most-contacted sibling
CNTCTKID,How often R contacts their most-contacted adult child
CNTCTFAM,How often R contacts their most-contacted extended family member
CNTCTFRD,How often R contacts their most-contacted close friend
INTCNTCT,"How much of R's communication is via text, mobile phone, or internet"
HEALTHISSP,MERGED HEALTHISSP_D AND HEALTHISSP_E
UNHAPPY,How often R was unhappy or depressed in past 4 weeks
PILINGUP,How often R felt difficulty piling up in past 4 weeks
MYGOALS,It is easy for R to accomplish their goals
SATLIFE,R is satisfied with their life
ENDSMEET,How difficult or easy is it for R's household to make ends meet
NUMLANGS,How many languages does R speak well enough to hold a conversation in?
OPWLTH,Need wealthy family to get ahead
OPPARED,Need educated parents to get ahead
OPEDUC,Need good education to get ahead
OPAMBIT,Need ambition to get ahead
OPABLE,Need natural ability to get ahead
OPHRDWRK,Need to work hard to get ahead
OPKNOW,Need to know right people to get ahead
OPCLOUT,Need political connections to get ahead
OPRACE,Need to be right race to get ahead
OPRELIG,Need to be right religion to get ahead
OPREGION,Must be from right region to get ahead
OPSEX,Need to be right sex to get ahead
OPPOL,Must have certain polviews to get ahead
GOODLIFE,Standard of living of R will improve
INCENTIV,Pay differences needed for motivation
INEQUAL1,Extra pay -> people take responsibility
INEQUAL2,Extra pay -> workers acquire skills
INEQUAL3,Inequality exists for benefit of rich
INEQUAL4,Extra pay -> people earn degrees
INEQUAL5,Pay differences -> American prosperity
INEQUAL6,Everyone benefits from business profits
INEQUAL7,Inequality due to lack of solidarity
PAYMASON,How much R thinks bricklayer makes
PAYDOC,How much R thinks doctor makes
PAYCLERK,How much R thinks bank clerk makes
PAYOWNER,How much R thinks shop owner makes
PAYEXEC,How much R thinks corporate head makes
PAYSKILL,How much R thinks skilled worker makes
PAYFARM,How much R thinks farm worker makes
PAYSEC,How much R thinks secretary makes
PAYBUS,How much R thinks bus driver makes
PAYUNSKL,How much R thinks unskilled wrkr makes
PAYCABNT,How much R thinks cabinet member makes
PAYLAW,How much R thinks lawyeR's make
PAYSALES,How much R thinks salesclerks make
PAYFCTRY,How much R thinks owner of a large factory makes
PAYJUDGE,How much R thinks supreme court justice makes
PAYROCC,How much R thinks workers in own occupation make
GIVMASON,How much ought mason make?
GIVDOC,How much ought doctor make?
GIVCLERK,How much ought bank clerk make?
GIVOWNER,How much ought shop owner make?
GIVEXEC,How much ought corporate head make?
GIVSKILL,How much ought skilled worker make?
GIVFARM,How much ought farm worker make?
GIVSEC,How much ought secretary make?
GIVBUS,How much ought bus driver make?
GIVUNSKL,How much ought unskilled worker make?
GIVCABNT,How much ought cabinet member make?
GIVLAW,How much ought lawyer make
GIVSALES,How much ought salesclerk make
GIVFCTRY,How much ought owner of a large factory makes
GIVJUDGE,How much ought justice make
GIVROCC,How much ought worker in own occupation make
INCGAP,Income differentials in usa too big
GOVEQINC,Govmnt should reduce inc differentials
GOVEDOP,Govmnt should help poor attend college
GOVJOBS,Govmnt should provide jobs
GOVLESS,Govmnt should spend less on poor
GOVUNEMP,Govmnt should provide unemp benefits
GOVMINC,Govmnt should provide minimum income
TAXRICH,Taxes on high income people too high
TAXMID,Taxes on middle income people too high
TAXPOOR,Taxes on low income people too high
TAXSHARE,Should rich pay bigger share of taxes?
CONWLTH,Conflict between poor and rich in usa?
CONCLASS,Working and middle classes in conflict?
CONJOBS,Employed and unemployed in conflict
CONUNION,Workers and management in conflict?
CONURBAN,FarmeR's and city people in conflict?
CONSOC,Conflict between social top and bottom
CONAGE,Conflict between young and old
OCCMOBIL,Status of job higher than Father's?
PAJOB,Type of job held by father when R 16
PASLF,Was father self-employed?
FIRSTJOB,Type of first job held by R
FIRSTSLF,First job self-employment?
LASTJOB,Type of current job held by R
LASTSLF,Current job self-employment?
REWRDEFF,Effort rewarded in America
REWRDINT,Intelligence and skill rewarded in America
CORRUPT,Must be corrupt to get to top in America
EARNDES,R deserves earnings
LDCGAP,Differences between rich and poor too large
LDCTAX,Rich countries pay tax to help poor countries
RICHHLTH,Rich buy better health care than poor
RICHEDUC,Rich buy better education than poor
PAYRESP,How much pay dependent on responsibility
PAYEDTRN,How much pay dependent on educ and training
PAYSUP,How much pay dependent on supervising others
PAYFAM1,How much pay dependent on family to support
PAYCHILD,How much pay dependent on children
PAYDOWEL,How much pay dependent on work well done
PAYHARD,How much pay dependent on working hard
JUSTPAY,Is R's pay just
SOCTYPE1,What type of society is America
SOCTYPE2,What type of society Does R prefer
FAMRNK,Rank in society of R
UNSKLRNK,Rank in society of unskilled workers
EXECRNK,Rank in society of chairmen
PASUP,R's father supervisor
BOOKS16,Books in home of R age 16
MAWRKWRM,Working mom can have a warm rel w kids
KIDSUFFR,Preschooler will suffer if mom works
FAMSUFFR,Family life suffers if mom works f-t
HAPIFWRK,Woman and family happier if she works
HOMEKID,Most women really want a home and kids
HOUSEWRK,Being housewife as fulfilling as paid work
FEJOBIND,Job is best way for woman to be indep
TWOINCS,Husb & wife should contrib to family income
HUBBYWRK,Husb shld work wife shld look after home
ILIKEJOB,R would enjoy job if money wasn't needed
WRKNOKID,"Shld mom work aftr marriage, before kids?"
WRKBABY,Shld woman with preschooler work?
WRKSCH,Shld woman work after youngest in school?
WRKGROWN,Shld woman work after kids leave home?
DAYCARE1,Public daycare center ok for kid < 3 yrs?
DAYCARE2,Private daycare center ok for kid < 3 yrs?
DAYCARE3,Babysitter ok for kid < 3 yrs?
DAYCARE4,Friend or neighbor ok for kid < 3 yrs?
DAYCARE5,Relative ok for kid < 3yrs?
FEMARRY,Way of life recommendation for woman
MEMARRY,Way of life recommendation for man
MARHAPPY,Married people happier than unmarried
MARFREE,Personal freedom more impt than marriage
MARFIN,Financial security main advtg of marriage
MARKIDS,Main purpose of marriage = kids
MARNOMAR,Bad marriage better than none at all
MARLEGIT,Those wanting kids should get married
MARMAKID,Single ma can raise kids well as couple
MARPAKID,Single pa can raise kids well as couple
MARDIV,Marriage not taken seriously when div is easy
MARHOMO,Homosexuals should have right to marry
MARHOMO1,Homosexuals have right to marry
NUMKIDS,What is ideal number of kids for family
NOKIDS,Desirability of no-kid family
ONEKID,Desirability of one-kid family
TWOKIDS,Desirability of two-kid family
THREKIDS,Desirability of three-kid family
FOURKIDS,Desirability of 4+ kid family
KIDTRBLE,Kids more trouble than they are worth
KIDJOY,Kids are life's greatest joy
KIDNOFRE,Kids interfere with parents' freedom
KIDLESS,Kidless marriage is incomplete
KIDFIN,Better not to have kids due to $ burden
KIDEMPTY,Kidless people lead empty lives
DIVNOW,How easy is it to get a divorce today
DIVNOKID,How easy should divorce be for kidless
DIVIFKID,How easy should divorce be if kids
DIVKIDS,Kids better if bad marrge ended by div
DIVWIFE,Wife better if bad marrge ended by div
DIVHUBBY,Husb better if bad marrge ended by div
MAWORK14,Did mom work before R was 14 yrs old
EVDIV,Has R ever been divorced
SPEVDIV,Has R's current spouse been divorced
COHABIT,Did R live with spouse before marriage
RWRKNOKD,Did R work aftr marrge but before kids
RWRKBABY,Did R work when kid was preschooler
RWRKSCH,Did R work after youngest in school
RWRKGRWN,Did R work after kids left home
EARNSMOR,Hubby or wife earns more $
FEWRKSUP,Do most women work to support family
HUBBYWK1,Men should earn money women keep house
MRMOM,Gender role reversal hurts family
MEOVRWRK,Men hurt family when focus on work too much
SINGLPAR,Single parents can raise kids as well as two
COHABOK,Living together as an acceptable option
COHABFST,People should live together before marriage
DIVBEST,Divorce as best solution to marital problems
DIVIFKD1,Should feuding parents stay together for kids
DIVNOKD1,Childless couples stay married even with problems
LIVNOWED,Did R live with partner before marriage
MAPAID,Should working women have paid maternity leave
CHLDCARE,Should families get benefits if both parents work
ABCHOOSE,Should a woman get an abortion for any reason
TEENSEX1,Morality of teens having sex
SEXHAR,R experienced sexual harassment
FAMBUDGT,How couples monitor budget
LAUNDRY,Who in household does laundry
REPAIRS,Who in household does small repaiR's
CARESICK,Who in household cares for sick in family
SHOPFOOD,Who in household shops for groceries
DINNER,Who in household plans meals
SPWKNOKD,Did spouse work after marriage before kids
SPWKBABY,Did spouse work with young children
SPWRKSCH,Did spouse work with school age children
SPWKGRWN,Did spouse work after children left home
MEHHWORK,Men ought to do more hh work than they do now
MEKDCARE,Men ought to do more childcare than they do now
LAUNDRY1,Who in household does laundry
REPAIRS1,Who in household does small repairs
CARESIK1,Who in household cares for sick in family
SHOP1,Who in household shops for groceries
CLEAN1,Who in household does cleaning
COOKING1,Who in household prepares the meals
RHHWORK,How many hours a week does R spend on hh work
SPHHWORK,How many hours a week does spouse on hh wrk
HHWKFAIR,Sharing of hh work between R and spouse
HHWKDIS,How often R and spouse disagree sharing of hh wrk
DECKIDS,Who makes decision about how to bring up children
SPBORN,When was your spouse born
WEEKEND,Who has final say about choosing weekend activity
BUYTHNGS,Who has final say about buying things for home
TIMEHOME,Run out of time before getting things done at home
STRSSHME,Life at home is rarely stressful
TIMEWORK,Run out of time before getting things done at work
STRSSWRK,Job Is Rarely stressful
TIREDHME,Come home from work too tired to do the chores
JOBVSFAM,Difficult to fulfill fam responsibility bc of job
TIREDWRK,Arrived at work too tired to function bc of hhwork
FAMVSWRK,Difficult to concentrate wrk bc of fam responsibility
HAPPY7,How happy R is
SATJOB7,Job satisfaction in general
SATFAM7,Family satisfaction in general
FEWKNOKD,Women should work outside when no kids
TWOINCS1,Both men and women should contribute to income
EARNSHH,Hubby or wife earns more dollars
SSFCHILD,Same sex female couple raise child as well as male-female couple
SSMCHILD,Same sex male couple raise child as well as male-female couple
KIDFINBU,Children are financial burden on parents
KIDJOB,Children limit emp and career opp for one or both parents
KIDSOCST,Having children increases social standing in society
ELDERSUP,Adult children are imp to help elderly parents
PAIDLV,Paid leave for childcare
PAIDLVPY,Who pays for leave
PAIDLVDV,Mother or father paid leave
FAMWKBST,Best way to org family work life with under school age child
FAMWKLST,WoR'st way to org family work life with under school age child
CAREPROV,Who should provide childcare for under school age child
CARECOST,Who should pay for costs of care for under school age child
ELDHELP,Who should provide help for elderly
ELDCOST,Who should pay for help for elderly
HHCLEAN1,Who does household cleaning
WKNDACT,Who decides weekend activities
TIREDHM1,How often too tired to do housework
JOBVSFA1,How often jobtakes too much time to fulfill family resp
TIREDWK1,How often too tired from housework to do job well
FAMVSWK1,How often difficult to conc at work because family resp
WKKIDSCL,Did R work outside home with child under school age
WKYNGSCL,Did R work outside home after child started school
WKKIDSCS,Did partner work outside home with child under school age
WKYNGSCS,Did partner work outside home after child started school
RFAMLOOK,HOW MANY HOURS A WEEK R SPENDS LOOKING AFTER FAMILY
SPFALOOK,Hours spouse spends looking after family members
SPLIVE,How long been living with spouse
TIMEPDWK,Time R would spend on paid work
TIMEHHWK,Time R would spend on household work
TIMEFAM,Time R would spend on family
TIMEFRND,Time R would spend on friends
TIMELEIS,Time R would spend on leisure
TIMERELX,Time R would spend relaxing
WRKEARN,Job is just a way to earn money
WRKENJOY,Enjoy job even if $ not needed
WRKIMP,Work is persons most impt. activity
HWDUTIES,Is R mainly respons.for hh chores?
YRSFIRM,Importance of tenure to pay
DOWELL,Importance of performance to pay
EXPERNC,Importance of experience to pay
PAYSAME,Importance of standard rates to pay
AGEEMP,Importance of age to pay
SEXEMP,Importance of gender to pay
FAMRESP,Importance of family resps. to pay
EDUCEMP,Importance of educ & qualif. to pay
DK,Don't know response to pay items
BOSSWRKS,Management & workers always in conflict
STRNGUN,Strong unions needed to protect workers
SECJOB,Importance of job security in a job
HIINC,Importance of high pr income in a job
PROMOTN,Importance of advancement in a job
LEISURE,Importance of leisure time in a job
INTJOB,Importance of interesting work in a job
WRKINDP,Importance of independent work in a job
HLPOTHS,Importance of helping others in a job
HLPSOC,Importance of social usefulness in a job
FLEXHRS,Importance of flexible hrs. in a job
FLEXHRS1,Importance of flexible hrs. at work
WKPERSNL,Importance of Personal contact at work
FAMORJOB,Would you sacrifice job opportunities for family
JOBORFAM,Would you remain in unsatisfying job for family
DISCWK5,Discrimination at work in past 5 yrs
WHYDISC5,Why were you discriminated against
HARASS5,Harassment at work in past 5 yrs
UNIONSBD,Strong trade unions are bad for us economy
RCONTACT,Do you have Personal contact at work
WKATHOME,How often do you work from home
WKWKENDS,Do you work weekends
DECIDWRK,How are your working hours decided
WRKSHIFT,What is your working schedule
CHNGEWRK,I would change my work for something different
NOUNEMP5,I would move within the usa for work
NOUNEMP6,I would move outside the usa for work
EXTRAWRK,Did you work multiple jobs in past yr
EXTRAERN,How much earned from additional jobs in past yr
JBENDYR,Year last paid job ended
JBENDMO,Month last paid job ended
EXJOBSAT,Satisfaction with past job
WORNOJOB,Do you worry about not finding job
NEWSKILL,I would accept job that requires new skills
LOWPAY,I would accept job for lower pay
TEMPWORK,I would accept temporary employment
MORTRAVL,I would accept a longer commute
MOVEINUS,I would move within the usa for work
MOVEAWAY,I would move outside the usa for work
ECONSUP1,Main source of economic support
WORECSUP,Do you worry about losing economic support
UNPEOPLE,Rank of no people contact when unemployed
UNMONEY,Rank of shortage of money when unemployed
UNSLFCON,Rank of loss of confide. when unemployed
UNRESPCT,Rank of loss of respect when unemployed
UNFAMTEN,Rank of family tensions when unemployed
UNJOBEXP,Rank of how to spend time when unemployed
UNBORED,Rank of boredom when unemployed
UNDK,Don't know response to unemployment items
EMPSELF,Does R prefer self-employment or not ?
SMALLBIG,R preference re: firm size in
INDUSOTH,"R preference re: manufacture service, etc"
PRIVGOVT,R preference re: private public sector
WORKWEEK,Does R work at least 10 hrs/wk
WANTJOB,Would R like a job now
FINDJOB,Could R find a job <unemployed R's>
IWRKHARD,How hard Does R work at job
HRSMONEY,R preference re: work hrs and money
RYRSFIRM,Importance of tenure
RDOWELL,Importance of performance
RPAYSAME,Importance of standard rates
REXPERNC,Importance of experience
RAGEEMP,Importance of age
RFAMRESP,Importance of family resps.
REDUCEMP,Importance of educ. & formal qual.
RDK,Don't know response to unemployment items
RSECJOB,R's job is secure
RHIINC,R's income is high
RPROMOTN,R has opportunity to advance
RLEISURE,R's job leaves much leisure time
RINTJOB,R's job is interesting
RWRKINDP,R can work independently
RHLPOTHS,R helps others in job
RHLPSOC,R's job is useful to society
RFLEXHRS,R's job has flexible hrs.
XHAUSTN,How often does work exhaust r
PHYSWRK,How often must R do physical work
STRESS,How often Does R find work stressful
BOREDOM,How often Is R bored at work
DANGER,How often Does R work in dangerous conds
UNHLTHY,How often Does R work in unhealthy conds
UNPLEZNT,How often Does R work in unpleasant conds
PLANWRK,How much can R plan daily work
FINDWORK,Could R find a job <employed R's>
BOSSEMPS,Quality of mgmnt-employee rels: R's firm
COWRKERS,Quality of rels among workers: R's firm
JOBSAT,How satisfied Is R with his/her job
SUPERVIS,Does R supervise others at work in main job
SUPRVSJB,Does R supervise others at work
SUPNUM,Number of workers R supervises
MOONLITE,Does R have a second job
OTHHRS,Hours R spends at other job<s>
NUMSITES,Does R's firm have more than one location
LOCALNUM,Number of employees: R's work site
TOTALNUM,Number of employees: R's entire firm
EMPLOYER,Does R employ others
NUMEMPLY,Number of persons R employs
PAYDOJOB,How important job well done in deciding pay
PAYFAM,How important family responsibility in deciding p
PAYEDUC,How important education in deciding pay
PAYTIME,How important be long with the firm in deciding p
TECHJOBS,New techs increase number of jobs
TECHWORK,New techs make work more interesting
WANTJOB1,Which job would you prefer
WORKNOW,Are you currently working for pay
SETHOURS,Who set working hours
PLACEWRK,Where do you work
WKTENURE,Describe your present job situation
USESKILL,How much past skills can you make use in present
EDCSKILL,How important school in developing skills
JOBSKILL,How important training in developing skills
HELPORG1,Willing to work harder for the firm
PRIDEORG,I am proud working for my firm
CHNGWORK,I would change my job for something else
STAYORG3,I would turn down job offering more pay
PROUDWRK,I am proud of the type of work I do
ABSENT,How many days absent from work past 6 month
LEAVEJOB,How likely will try to find another firm
WORRYJOB,Do you worry about losing job
EVJOB,Have you ever had a paid job for 1 year or+
YRJOBEND,When did your last paid job end
WHYJBEND,Main reason your job end
WANTJOB2,Would like to have a job now or in the future
GETJOB,How likely you would find a job
LOOKJOB,Are you looking for a job
PUBAGNCY,Registered at a public employment agency
PRIAGNCY,Registered at a private employment agency
WANTADS,Answered advertisements for jobs
ADFORJOB,Advertised for a job in newspapeR's
APPEMPS,Applied directly to employers
ASKHELP,Asked relatives friends colleagues to help
ECONSUP,Main source of economic support
SELFEMP1,Employee have more job security than the self-employed
SELFEMP2,Being employee interfere more with family life than self-employment
UNJOBSEC,Unions are very important for job security
UNBETTER,Working condition would be much worse without unions
RIMPSKLS,Job gives R chance to improve skills
DAILYWRK,How R's daily work is organized
TIMEOFF,How difficult R takes an hour off during working hours
JBINTFAM,How often R felt: demand of job interfere with family life
FAMINTJB,How often R felt: demand of family life interfere with job
NEWJOB,How helpful present work skill would be for new job
JBTRAIN,Did R have any training to improve job skill past 12 months
JOBEASY,How easy if R find a job as good as current one
REPLACEU,How easy R's firm replaces R if R left
NOUNEMP1, R would accept job requiring new skill to avoid unemployment
NOUNEMP2, R would accept position with lower pay to avoid unemployment
NOUNEMP3, R would accept temporary employment to avoid unemployment
NOUNEMP4, R would accept travel longer to work to avoid unemployment
OTHERWRK,Does R have any additional job
SKLTRAIN,R had job skill training in thepast 12 months
SPWRKGVT,Spouse working for government
HAPUNHAP,Happy or unhappy with life today
STIFFPUN,Lawbreakers should get stiffer sentences
DEATHPEN,Murderers should get death penalty
PREMARS1,Is premarital sex wrong?
XMARSEX1,Is extramarital sex wrong?
HOMOSEX1,Is homosexual sex wrong?
ABDEFCT1,Law should allow abortion for birth defects
ABPOOR1,Law should allow abortion if family low income
ABDEFCTW,Wrong for woman to get abortion for birth defects
ABPOORW,Wrong for woman to get abortion if low income?
TAXCHEAT,Wrong to cheat on taxes?
GOVCHEAT,Wrong to give govt false info for benefits?
CONCONG,Confidence in us congress
CONBIZ,Confidence in business and industry
CONGOVT,Confidence in government departments
CONCHURH,Confidence in churches and religious orgs
CONCOURT,Confidence in courts and legal system
CONSCHLS,Confidence in schools and educ system
POLSGOD,Atheists shouldn't hold public office
CLERGVTE,Clergy shouldn't try to influence voters
RELIGPUB,Better if more believers held public office
CLERGGOV,Clergy shouldn't try to influence govt decisions
CHURHPOW,Do churches have too much power?
GODCHNGE,Describe your beliefs about god
AFTERLIF,Belief in life after death
DEVIL,Belief in the devil
HEAVEN,Belief in heaven
HELL,Belief in hell
MIRACLES,Belief in religious miracles
BIBLE1,Describe your feelings about the bible
THEISM,God concerned with human beings Personally
FATALISM,People can't change the course of their lives
GODMEANS,Life meaningful because god exists
NIHILISM,Life serves no purpose
PREDETER,God decides the course of our lives
EGOMEANS,Life meaningful only if you provide meaning
OWNFATE,We each make our own fate
RELEXPER,Turning point in life for religion
MARELKID,Mothers religion when R was child
MADENKID,"If protestant, Mothers denomination"
PARELKID,Father's religion when R was child
PADENKID,"If protestant, Father's denomination"
RELIGKID,Religion R was raised in
DENKID,"If protestant, denomination R raised in"
RELIGSP,R's spouse's religion
DENSP,"If protestant, R's spouse's denomination"
ATTENDMA,Freq of R's mom's relig svc attendance
ATTENDPA,Freq of R's dad's relig svc attendance
ATTEND12,Freq of R's relig svc attendance at age 12
PRAYFREQ,How often does R pray
RELACTIV,How often does R take part in relig activities
RELACTIV1,How often does R take part in relig activities
RELSCRPT,R has read religious text outside of a service in the past year
FEELREL,How religious Is R
SCHLPRAY,Should there be daily prayer in public schools?
GODRIGHT,God's laws should decide right and wrong
SOCRIGHT,Society's laws should decide right and wrong
PERRIGHT,Conscience should decide right and wrong
ANTIREL,Anti-religious material should be banned
BEFAIR,How often do you think people take advantage
CANTRUST,People can be trusted or cant be too careful
TRUSTSCI,We trust too much in science
RELIGCON,Religions bring more conflict
RELIGINT,Religious people are often too intolerant
RELIGINF,The U.S. would be a better country if religion had less influence
VOLWKPOL,Volunteered political activities past 12 month
VOLWKCHR,Volunteered charitable past 12 month
VOLWKREL,Volunteered religious past 12 month
VOLWKOTH,Volunteered other kinds past 12 month
RELTRUTH,How much truth in religion
CARRIGHT,What your friend has a right to expect from you
CARDO,What would you do in this situation
GEOMOBIL,Has R moved from one kind of place to another
RELGRPEQ,All religious groups in usa should have equal rights
RSPCTREL,We must respect all religions
